[
  {
    "EscrowId": 2000000,
    "LoanId": 100245,
    "LastEscrowAnalysisDate": "2026-05-01T00:00:00",
    "LastEscrowAnalysisOverShortAmount": 20,
    "InterestOnEscrowFlag": false,
    "EscrowAdvanceBalanceAmount": null,
    "TaxContractIdentifier": "sit dolore aute"
  },
  {
    "EscrowId": 2000001,
    "LoanId": 100245,
    "LastEscrowAnalysisDate": "2026-05-01T00:00:00",
    "LastEscrowAnalysisOverShortAmount": 20,
    "InterestOnEscrowFlag": false,
    "EscrowAdvanceBalanceAmount": null,
    "TaxContractIdentifier": null
  },
  {
    "EscrowId": 2000002,
    "LoanId": 100245,
    "LastEscrowAnalysisDate": "2026-05-01T00:00:00",
    "LastEscrowAnalysisOverShortAmount": 20,
    "InterestOnEscrowFlag": false,
    "EscrowAdvanceBalanceAmount": null,
    "TaxContractIdentifier": null
  },
  {
    "EscrowId": 2000003,
    "LoanId": 100245,
    "LastEscrowAnalysisDate": "2026-05-01T00:00:00",
    "LastEscrowAnalysisOverShortAmount": 20,
    "InterestOnEscrowFlag": false,
    "EscrowAdvanceBalanceAmount": null,
    "TaxContractIdentifier": null
  },
  {
    "EscrowId": 2000004,
    "LoanId": 100245,
    "LastEscrowAnalysisDate": "2026-05-01T00:00:00",
    "LastEscrowAnalysisOverShortAmount": 20,
    "InterestOnEscrowFlag": false,
    "EscrowAdvanceBalanceAmount": 19656210.29958129,
    "TaxContractIdentifier": "aliqua nostrud"
  }
]
