[
  {
    "EscrowId": 2000000,
    "LoanId": 100311,
    "LastEscrowAnalysisDate": "2026-03-01T00:00:00",
    "LastEscrowAnalysisOverShortAmount": 20,
    "InterestOnEscrowFlag": false,
    "EscrowAdvanceBalanceAmount": null,
    "TaxContractIdentifier": null
  },
  {
    "EscrowId": 2000001,
    "LoanId": 100311,
    "LastEscrowAnalysisDate": "2026-03-01T00:00:00",
    "LastEscrowAnalysisOverShortAmount": 20,
    "InterestOnEscrowFlag": false,
    "EscrowAdvanceBalanceAmount": 19748010.71919501,
    "TaxContractIdentifier": "non ex"
  },
  {
    "EscrowId": 2000002,
    "LoanId": 100311,
    "LastEscrowAnalysisDate": "2026-03-01T00:00:00",
    "LastEscrowAnalysisOverShortAmount": 20,
    "InterestOnEscrowFlag": false,
    "EscrowAdvanceBalanceAmount": null,
    "TaxContractIdentifier": "nostrud"
  }
]
