[
  {
    "EscrowId": 2000000,
    "LoanId": 100721,
    "LastEscrowAnalysisDate": "2026-04-01T00:00:00",
    "LastEscrowAnalysisOverShortAmount": 20,
    "InterestOnEscrowFlag": false,
    "EscrowAdvanceBalanceAmount": null,
    "TaxContractIdentifier": null
  },
  {
    "EscrowId": 2000001,
    "LoanId": 100721,
    "LastEscrowAnalysisDate": "2026-04-01T00:00:00",
    "LastEscrowAnalysisOverShortAmount": 20,
    "InterestOnEscrowFlag": false,
    "EscrowAdvanceBalanceAmount": -78453210.69471538,
    "TaxContractIdentifier": null
  },
  {
    "EscrowId": 2000002,
    "LoanId": 100721,
    "LastEscrowAnalysisDate": "2026-04-01T00:00:00",
    "LastEscrowAnalysisOverShortAmount": 20,
    "InterestOnEscrowFlag": false,
    "EscrowAdvanceBalanceAmount": null,
    "TaxContractIdentifier": "nostrud"
  },
  {
    "EscrowId": 2000003,
    "LoanId": 100721,
    "LastEscrowAnalysisDate": "2026-04-01T00:00:00",
    "LastEscrowAnalysisOverShortAmount": 20,
    "InterestOnEscrowFlag": false,
    "EscrowAdvanceBalanceAmount": null,
    "TaxContractIdentifier": "dolore"
  }
]
