[
  {
    "EscrowId": 2000000,
    "LoanId": 100333,
    "LastEscrowAnalysisDate": "2026-05-01T00:00:00",
    "LastEscrowAnalysisOverShortAmount": 20,
    "InterestOnEscrowFlag": false,
    "EscrowAdvanceBalanceAmount": null,
    "TaxContractIdentifier": "cupidatat eu proident"
  },
  {
    "EscrowId": 2000001,
    "LoanId": 100333,
    "LastEscrowAnalysisDate": "2026-05-01T00:00:00",
    "LastEscrowAnalysisOverShortAmount": 20,
    "InterestOnEscrowFlag": false,
    "EscrowAdvanceBalanceAmount": 5740155.139937997,
    "TaxContractIdentifier": "id Ut reprehenderit aute"
  },
  {
    "EscrowId": 2000002,
    "LoanId": 100333,
    "LastEscrowAnalysisDate": "2026-05-01T00:00:00",
    "LastEscrowAnalysisOverShortAmount": 20,
    "InterestOnEscrowFlag": false,
    "EscrowAdvanceBalanceAmount": 70557773.90487492,
    "TaxContractIdentifier": "cupidatat"
  },
  {
    "EscrowId": 2000003,
    "LoanId": 100333,
    "LastEscrowAnalysisDate": "2026-05-01T00:00:00",
    "LastEscrowAnalysisOverShortAmount": 20,
    "InterestOnEscrowFlag": false,
    "EscrowAdvanceBalanceAmount": null,
    "TaxContractIdentifier": "pariatur esse"
  },
  {
    "EscrowId": 2000004,
    "LoanId": 100333,
    "LastEscrowAnalysisDate": "2026-05-01T00:00:00",
    "LastEscrowAnalysisOverShortAmount": 20,
    "InterestOnEscrowFlag": false,
    "EscrowAdvanceBalanceAmount": -53319930.28521538,
    "TaxContractIdentifier": null
  }
]
