[
  {
    "EscrowId": 2000000,
    "LoanId": 100118,
    "LastEscrowAnalysisDate": "2026-05-01T00:00:00",
    "LastEscrowAnalysisOverShortAmount": 20,
    "InterestOnEscrowFlag": false,
    "EscrowAdvanceBalanceAmount": -59574679.93721366,
    "TaxContractIdentifier": null
  },
  {
    "EscrowId": 2000001,
    "LoanId": 100118,
    "LastEscrowAnalysisDate": "2026-05-01T00:00:00",
    "LastEscrowAnalysisOverShortAmount": 20,
    "InterestOnEscrowFlag": false,
    "EscrowAdvanceBalanceAmount": null,
    "TaxContractIdentifier": "incididunt fugiat laboris est ipsum"
  },
  {
    "EscrowId": 2000002,
    "LoanId": 100118,
    "LastEscrowAnalysisDate": "2026-05-01T00:00:00",
    "LastEscrowAnalysisOverShortAmount": 20,
    "InterestOnEscrowFlag": false,
    "EscrowAdvanceBalanceAmount": null,
    "TaxContractIdentifier": null
  },
  {
    "EscrowId": 2000003,
    "LoanId": 100118,
    "LastEscrowAnalysisDate": "2026-05-01T00:00:00",
    "LastEscrowAnalysisOverShortAmount": 20,
    "InterestOnEscrowFlag": false,
    "EscrowAdvanceBalanceAmount": -51571560.418233275,
    "TaxContractIdentifier": null
  },
  {
    "EscrowId": 2000004,
    "LoanId": 100118,
    "LastEscrowAnalysisDate": "2026-05-01T00:00:00",
    "LastEscrowAnalysisOverShortAmount": 20,
    "InterestOnEscrowFlag": false,
    "EscrowAdvanceBalanceAmount": 17455496.033653617,
    "TaxContractIdentifier": "sint ut reprehenderit amet id"
  }
]
