[
  {
    "EscrowId": 2000000,
    "LoanId": 100830,
    "LastEscrowAnalysisDate": "2026-05-01T00:00:00",
    "LastEscrowAnalysisOverShortAmount": 20,
    "InterestOnEscrowFlag": false,
    "EscrowAdvanceBalanceAmount": -48883316.85215235,
    "TaxContractIdentifier": "adipisicing magna ut"
  },
  {
    "EscrowId": 2000001,
    "LoanId": 100830,
    "LastEscrowAnalysisDate": "2026-05-01T00:00:00",
    "LastEscrowAnalysisOverShortAmount": 20,
    "InterestOnEscrowFlag": false,
    "EscrowAdvanceBalanceAmount": -35656799.46914315,
    "TaxContractIdentifier": "commodo Duis"
  },
  {
    "EscrowId": 2000002,
    "LoanId": 100830,
    "LastEscrowAnalysisDate": "2026-05-01T00:00:00",
    "LastEscrowAnalysisOverShortAmount": 20,
    "InterestOnEscrowFlag": false,
    "EscrowAdvanceBalanceAmount": 31400249.66560304,
    "TaxContractIdentifier": "eiusmod et dolor mollit voluptate"
  },
  {
    "EscrowId": 2000003,
    "LoanId": 100830,
    "LastEscrowAnalysisDate": "2026-05-01T00:00:00",
    "LastEscrowAnalysisOverShortAmount": 20,
    "InterestOnEscrowFlag": false,
    "EscrowAdvanceBalanceAmount": -58193644.22932267,
    "TaxContractIdentifier": null
  },
  {
    "EscrowId": 2000004,
    "LoanId": 100830,
    "LastEscrowAnalysisDate": "2026-05-01T00:00:00",
    "LastEscrowAnalysisOverShortAmount": 20,
    "InterestOnEscrowFlag": false,
    "EscrowAdvanceBalanceAmount": null,
    "TaxContractIdentifier": "Duis anim dolor aliqua"
  }
]
